[
  {
    "station_id": "ST-00001",
    "version": "1.0.0",
    "title": "DVLA — the patient who won't stop driving",
    "status": "draft",
    "domain": {
      "primary_topic": "D5.4.4",
      "secondary_topics": ["D5.4.2", "D5.1.2", "D5.7.4"],
      "assessment_domains": ["D5", "D8"]
    },
    "format": {"primary": "ES", "secondary": ["FU"], "engines": ["E1", "E3"]},
    "scenario": {
      "context": "GP",
      "applicant_role": "You are not in this scenario. You are being asked to reason about a situation a doctor faces. You are not expected to know the law.",
      "opening_prompt": "A doctor has told a patient that a recent diagnosis means they must inform the DVLA and stop driving. At the next appointment the patient says they have not told the DVLA and are still driving to work. What should the doctor be thinking about?",
      "candidate_brief": "You have one minute to read this before the station begins."
    },
    "delivery": {
      "preparation_time_seconds": 60,
      "response_time_seconds": 300,
      "mode": "live_voice",
      "interruption_permitted": true,
      "notes_permitted": false,
      "adjustments_available": ["extended time", "rephrasing on request"]
    },
    "assessment": {
      "scoring_dimensions": [
        {"dimension": "S1", "weight": 0.25},
        {"dimension": "S2", "weight": 0.15},
        {"dimension": "S3", "weight": 0.35},
        {"dimension": "S6", "weight": 0.25}
      ],
      "expected_content": [
        {"point": "Recognises the legal duty to notify sits with the DRIVER, not the doctor", "necessity": "expected", "evidence_cues": ["it's their responsibility to tell the DVLA", "the patient has to notify"], "counts_only_if_applied": false},
        {"point": "The doctor's first move is to explain the duty and make every reasonable effort to persuade the patient to stop", "necessity": "required", "evidence_cues": ["explain why", "try to persuade", "understand why they won't stop"]},
        {"point": "Identifies WHY the patient might be refusing — work, independence, caring responsibilities — rather than treating refusal as obstinacy", "necessity": "expected", "evidence_cues": ["they might need it for work", "what's driving losing their licence mean for them"]},
        {"point": "Applies a risk threshold: does continued driving expose OTHERS to a risk of death or serious harm", "necessity": "required", "evidence_cues": ["risk to other people", "could seriously harm someone else"]},
        {"point": "Treats disclosure as a balance, not an automatic consequence of refusal", "necessity": "expected", "evidence_cues": ["weigh", "on the other hand", "it depends on"]},
        {"point": "Tells the patient before disclosing, where practicable, and confirms in writing afterwards", "necessity": "optional_strong", "evidence_cues": ["tell them I was going to", "let them know afterwards", "in writing"]},
        {"point": "Names confidentiality as the default that is being departed from, and why that default exists", "necessity": "expected", "evidence_cues": ["confidentiality matters because", "people need to be able to tell their doctor"], "counts_only_if_applied": true}
      ],
      "optional_strong_points": [
        "Distinguishes this public-interest discretion from a statutory duty such as notifiable disease reporting, where no balancing is required",
        "Notes that the doctor should document the decision either way",
        "Recognises the doctor may seek advice from a defence body or a senior colleague first"
      ],
      "red_flags": [
        {"flag": "States that the doctor must report the patient to the DVLA, as a legal duty on the doctor", "severity": "note", "detection_cues": ["the doctor has to report them", "it's the doctor's legal duty to inform"]},
        {"flag": "Would disclose immediately with no attempt to persuade and no risk assessment", "severity": "concern", "detection_cues": ["I'd just call the DVLA", "straight away"]},
        {"flag": "Would take no action at all because confidentiality is absolute", "severity": "serious", "detection_cues": ["confidentiality is absolute", "nothing they can do"]},
        {"flag": "Offers a clinical judgement about whether the condition actually affects driving", "severity": "concern", "detection_cues": ["that condition wouldn't really affect", "they're probably fine to drive"]}
      ],
      "model_answer_principles": [
        "The sequence matters more than the conclusion: explain, persuade, assess risk to others, warn, disclose, confirm in writing.",
        "Confidentiality is departed from on a balance, not overridden by a rule.",
        "Understanding the refusal is part of managing it, not a preliminary courtesy."
      ],
      "band_descriptors": {
        "poor": "Jumps straight to reporting, or refuses to consider disclosure at all. No risk reasoning.",
        "borderline": "Reaches the right end point but skips persuasion or the risk-to-others test. May assert the doctor has a legal duty to report.",
        "competent": "Works through the sequence, names risk to others as the threshold, treats disclosure as a balance.",
        "excellent": "All of the above plus the patient's perspective explored, the doctor's onward communication addressed, and confidentiality's purpose articulated rather than named."
      }
    },
    "adaptive": {
      "planned_followups": [
        {"prompt": "What would you want to know about why they're still driving?", "purpose": "deepen"},
        {"prompt": "Does it make a difference if they drive a school minibus rather than commuting alone?", "purpose": "challenge"}
      ],
      "conditional_followups": [
        {"trigger": {"type": "content_gap", "detail": "no risk-to-others threshold stated"}, "prompt": "You've said the doctor might have to break confidentiality. What would have to be true for that to be justified?", "purpose": "specify", "priority": 1},
        {"trigger": {"type": "unsafe_reasoning", "detail": "confidentiality treated as absolute"}, "prompt": "Is there any circumstance in which a doctor could share information without consent?", "purpose": "safety_check", "priority": 1},
        {"trigger": {"type": "generic_answer", "detail": "four principles recited without application"}, "prompt": "Which two of those are actually pulling against each other here, and what would make one give way?", "purpose": "challenge", "priority": 2},
        {"trigger": {"type": "strong_answer"}, "prompt": "Suppose the doctor tells the DVLA and it turns out the patient had already notified them. Was the doctor wrong to act?", "purpose": "challenge", "priority": 3}
      ],
      "max_followups": 3,
      "interrupt_policy": "on_time_only",
      "do_not_lead": ["risk of death or serious harm", "the driver has the legal duty", "public interest"]
    },
    "difficulty": {
      "band": "3_stretch",
      "variables": {"AMBIG": 2, "EMO": 0, "CONFL": 3, "HIDDEN": 0, "SAFEG": 1, "TIME": 1, "MISLEAD": 2, "HOSTILE": 2, "INCOMP": 1, "ETHUNC": 3, "OVERC": 1, "CHALL": 0, "LIMITS": 1}
    },
    "university_compatibility": {"mode": "universal", "requires_application_questioning": false},
    "provenance": {
      "author": "content-team",
      "created": "2026-08-29",
      "source_basis": [
        {"type": "gmc_guidance", "reference": "GMC — Patients' fitness to drive and reporting concerns to the DVLA or DVA, paras 3, 4, 6, 9, 10", "date_checked": "2026-08-29", "quote": "The driver is legally responsible for telling the DVLA or DVA about any such condition or treatment."},
        {"type": "gmc_guidance", "reference": "GMC Confidentiality, paras 63-68 (public interest) and para 87 (required by law)", "date_checked": "2026-08-29"}
      ],
      "confidence": "HIGH"
    },
    "governance": {
      "clinical_knowledge_boundary": "CONTEXT",
      "clinical_bait": true,
      "premed_appropriate": "yes",
      "temporality": "SLOW",
      "review_date": "2027-08-29",
      "clinical_review": {"required": true},
      "sensitivity_flags": ["none"],
      "wellbeing_rules": ["Do not ask the candidate about their own or a family member's driving or health"]
    }
  },

  {
    "station_id": "ST-00002",
    "version": "1.0.0",
    "title": "The relative who has been waiting (roleplay)",
    "status": "draft",
    "domain": {
      "primary_topic": "D2.4.2",
      "secondary_topics": ["D3.1.1", "D4.5.1", "D2.5.1"],
      "assessment_domains": ["D2", "D3", "D4"]
    },
    "format": {"primary": "RP", "engines": ["E2"]},
    "scenario": {
      "context": "HOSP",
      "applicant_role": "You are a hospital volunteer on the day-surgery reception desk. You have no access to clinical information, no access to the patient list, and no authority over theatre scheduling. You may speak to the nurse in charge.",
      "opening_prompt": "Marcus Adeyemi is at the desk. His mother came in at seven this morning for day surgery. It is now half past two and he has had no update. Please speak to him.",
      "candidate_brief": "You have one minute to read this. The station lasts seven minutes.",
      "actor": {"type": "REL", "roleplay_ref": "RP-001"}
    },
    "delivery": {
      "preparation_time_seconds": 60,
      "response_time_seconds": 420,
      "mode": "live_voice",
      "interruption_permitted": true,
      "notes_permitted": false,
      "adjustments_available": ["extended time", "transcript-first delivery"]
    },
    "assessment": {
      "scoring_dimensions": [
        {"dimension": "S1", "weight": 0.2},
        {"dimension": "S2", "weight": 0.25},
        {"dimension": "S5", "weight": 0.3, "interactive_only": true},
        {"dimension": "S6", "weight": 0.25}
      ],
      "expected_content": [
        {"point": "States their role accurately and early — volunteer, no access to clinical information", "necessity": "required", "evidence_cues": ["I'm a volunteer here", "I don't have access to"]},